{
  "schema_version": "2.0.0",
  "sidecar_type": "NEXT_ACTION",
  "markdown_source": "project-runtime/NEXT_ACTION.md",
  "state_revision": 1,
  "updated_at": "2026-01-01T00:00:00Z",
  "updated_by": "orchestrator",
  "content": {
    "action_id": "ACTION-FIXTURE-001",
    "action_type": "create_agent",
    "target_role": "runtime_architect",
    "task_id": "TASK_FIXTURE_STATE_001",
    "task_packet": "project-runtime/tasks/active/TASK_FIXTURE_STATE_001.md",
    "dependency_status": "ready",
    "action_semantic": "dispatch",
    "workspace_identity_required": true,
    "repository_lock_required": true,
    "checkpoint_policy": "not_required",
    "requester_return_context": {
      "required": false,
      "return_to_role_after_audit_pass": "",
      "return_task_after_audit_pass": ""
    },
    "blocked_by": [],
    "summary": "Dispatch the fixture runtime architect task."
  }
}
